<?xml version="1.0" encoding="UTF-8"?>
<dataTypes xmlns="http://lang.whole.org/XsdDatatypes" xmlns:xsi="http://www.w3.org/2001/XMLSchema-instance" xsi:schemaLocation="http://lang.whole.org/XsdDatatypes datatypes.xsd">
	<boolean>true</boolean>
	<boolean>false</boolean>
	<byte>127</byte>
	<byte>-128</byte>
	<short>-32768</short>
	<short>32767</short>
	<int>-2147483648</int>
	<int>2147483647</int>
	<long>-9223372036854775808</long>
	<long>9223372036854775807</long>
	<float>-INF</float>
	<float>INF</float>
	<float>NaN</float>
	<float>3.14</float>
	<float>-10000.0</float>
	<float>1.26743237E15</float>
	<double>-INF</double>
	<double>INF</double>
	<double>NaN</double>
	<double>3.14</double>
	<double>-10000.0</double>
	<double>1.26743233E15</double>

	<date>1999-10-10</date>
	<dateTime>1990-11-30T12:30:43Z</dateTime>
	<time>12:30:43</time>
	<yearMonth>1990-11</yearMonth>
	<duration>P5Y</duration>

	<decimal>8347923570435095219358.73248923874</decimal>
	<integer>834792357043509521935873248923874</integer>
</dataTypes>
